[
  {
    "id": "E01-S001",
    "起": "00:01.0",
    "止": "00:03.0",
    "文本": "今天必须说清楚。",
    "声线": "E01-V1",
    "听辨": "清楚"
  },
  {
    "id": "E01-S002",
    "起": "00:04.0",
    "止": "00:05.0",
    "文本": "我马上",
    "声线": "E01-V1",
    "听辨": "清楚"
  },
  {
    "id": "E01-S003",
    "起": "00:05.0",
    "止": "00:06.0",
    "文本": "回来！",
    "声线": "E01-V1",
    "听辨": "清楚"
  },
  {
    "id": "E01-S004",
    "起": "00:08.0",
    "止": "00:09.0",
    "文本": "你在门口等",
    "声线": "E01-V1",
    "听辨": "清楚"
  },
  {
    "id": "E01-S005",
    "起": "00:25.0",
    "止": "00:26.0",
    "文本": "只有声音",
    "声线": "E01-V1",
    "听辨": "清楚"
  },
  {
    "id": "E01-S006",
    "起": "00:30.0",
    "止": "00:31.0",
    "文本": "ABC12出发",
    "声线": "E01-V1",
    "听辨": "清楚"
  }
]
