[
  {
    "id": "E01-S001",
    "起": "00:05.0",
    "止": "00:07.0",
    "文本": "今天必须说清楚。",
    "声线": "E01-V1",
    "听辨": "清楚"
  },
  {
    "id": "E01-S002",
    "起": "00:10.0",
    "止": "00:12.0",
    "文本": "合同的最后一页还没有签字。",
    "声线": "E01-V1",
    "听辨": "清楚"
  },
  {
    "id": "E01-S003",
    "起": "00:18.0",
    "止": "00:19.0",
    "文本": "原件在这里。",
    "声线": "E01-V2",
    "听辨": "清楚"
  }
]
