[
  {
    "id": "E01-S001",
    "起": "00:02.0",
    "止": "00:03.0",
    "文本": "今天必须说清楚。",
    "声线": "E01-V1",
    "听辨": "清楚"
  },
  {
    "id": "E01-S002",
    "起": "00:05.0",
    "止": "00:06.0",
    "文本": "原件在这里。",
    "声线": "E01-V2",
    "听辨": "清楚"
  },
  {
    "id": "E01-S003",
    "起": "00:08.0",
    "止": "00:09.0",
    "文本": "先把门打开。",
    "声线": "E01-V1",
    "听辨": "清楚"
  },
  {
    "id": "E01-S004",
    "起": "00:11.0",
    "止": "00:12.0",
    "文本": "把信封给我。",
    "声线": "E01-V2",
    "听辨": "清楚"
  },
  {
    "id": "E01-S005",
    "起": "00:14.0",
    "止": "00:15.0",
    "文本": "我已经看过了。",
    "声线": "E01-V1",
    "听辨": "清楚"
  },
  {
    "id": "E01-S006",
    "起": "00:17.0",
    "止": "00:18.0",
    "文本": "现在可以走了。",
    "声线": "E01-V2",
    "听辨": "清楚"
  }
]
